ชื่อเรื่อง,ผู้ประดิษฐ์,วันที่เอกสารเข้า,เลขที่หนังสือ,เลขที่ลงรับ iNT,สถานะการดำเนินงาน
การพัฒนาแอปพลิเคชันเพื่อการเรียนรู้ภาษาไทย,สมชาย ใจดี,10/26/2023,RES-2023-001,iNT003,อนุมัติ
การศึกษาผลกระทบของภาวะโลกร้อนต่อการเกษตรในประเทศไทย,สมหญิง เก่งกล้า,10/27/2023,RES-2023-002,iNT001,
การสังเคราะห์วัสดุนาโนเพื่อใช้ในการบำบัดน้ำเสีย,วิโรจน์ กล้าหาญ,10/28/2023,RES-2023-003,iNT004,อนุมัติ
การพัฒนาหุ่นยนต์เพื่อช่วยเหลือผู้สูงอายุ,สุภาพร ขยันเรียน,10/29/2023,RES-2023-004,iNT002,
การศึกษาความหลากหลายทางชีวภาพในป่าดิบชื้น,เดชา รักธรรมชาติ,10/30/2023,RES-2023-005,iNT005,เสนอโครงการ
